{
  "$schema": "../../schema/stl-library.schema.json",
  "id": "example-library",
  "name": "Example STL library (template)",
  "summary": "Template showing how to register a library of existing STLs. Copy, rename, and replace the items.",
  "authors": [
    {
      "name": "Your name"
    }
  ],
  "license": {
    "spdx": "CC-BY-4.0",
    "public_use": "review",
    "notes": "Set to ok once you have confirmed redistribution rights."
  },
  "storage": {
    "kind": "git-lfs",
    "base": "libraries/example-library/"
  },
  "items": [
    {
      "id": "bin-1x1x3",
      "name": "1x1x3 bin",
      "system": "gridfinity",
      "category": "bins",
      "tags": [
        "bin",
        "plain"
      ],
      "dimensions": {
        "x": 1,
        "y": 1,
        "z": 3
      },
      "files": [
        {
          "path": "bin-1x1x3.stl",
          "format": "stl"
        }
      ],
      "thumbnail": "bin-1x1x3.png"
    }
  ]
}
